{
  "schema": "wang-run-case-v1",
  "id": "unsat-search",
  "title": "UNSAT depth-two search with backtracking",
  "classification": "unsat-non-superficial-search",
  "description": "A complete optimized native run that survives initial propagation, reaches search depth two, and exhausts alternatives through multiple conflicts and backtracks.",
  "source": "tests/instances/pipeline_unsat_search.cm13",
  "solver": "optimized",
  "expected_status": "unsat",
  "trace": {
    "event_capacity": 8192,
    "checkpoint_interval": 128,
    "checkpoint_capacity": 64
  },
  "initial_domain_overrides": []
}
